{
  "schema_version": "bifrost.kv_object.v1alpha1",
  "provenance": {
    "source": "native_valid",
    "producer_hostname": "localhost",
    "producer_commit": "0000000000000000000000000000000000000000",
    "notes": "Generated by tools/generate_phase1_fixtures.py."
  },
  "prefix_profile": {
    "tokenizer_hash": "blake3:7a96ceadf37d65c8bdc3bcd40f954bf7361e40828fe5d202769fda3746610750",
    "token_range": {
      "start": 0,
      "end": 256
    },
    "token_hash": "blake3:e28db4d5960dae65182b4c9c5f76d8a84d8f9f7fc58e0a774f5f6607fa44a160",
    "token_count": 256,
    "rope_config_hash": "blake3:f27e0d4cd6df04c819b1541504d7886f5b1d320ee2efb3f5dc0f684d78353ebe",
    "prefix_hash": "blake3:d5bb4d3aefdd58fbed7b4bb471516c6cf710eafee755378c69059ff45e061023",
    "mm_hashes": [],
    "absolute_position_range": {
      "start": 0,
      "end": 256
    }
  },
  "payload_profile": {
    "payload_encoding": "raw_bytes",
    "compression": "none",
    "byte_length": 786432
  },
  "opaque_engine_profile": null,
  "object_type": "native_kv_page",
  "object_id": "bifrost://object/blake3/5e515c8340de72c52cc23e54345c51f185c06e49f8cadd8a4808da95e1854e32",
  "native_tensor_profile": {
    "token_range": {
      "start": 0,
      "end": 256
    },
    "tensor_shape": [
      2,
      256,
      12,
      64
    ],
    "tensor_role": "kv_pair",
    "tensor_layout": "kv_token_head_dim",
    "tensor_dtype": "float16",
    "layer_id": 0,
    "kv_block_id": 0,
    "block_token_count": 256,
    "block_size_tokens": 256
  },
  "model_profile": {
    "tokenizer_hash": "blake3:7a96ceadf37d65c8bdc3bcd40f954bf7361e40828fe5d202769fda3746610750",
    "rope_config_hash": "blake3:f27e0d4cd6df04c819b1541504d7886f5b1d320ee2efb3f5dc0f684d78353ebe",
    "quantization": "none",
    "num_layers": 12,
    "num_kv_heads": 12,
    "num_attention_heads": 12,
    "model_revision": "local",
    "model_id": "tiny-gpt",
    "model_hash": "blake3:b31dc7f5e94ff0290a04b7eaf3d1dda0c3036ac80682e5aecc658ccb46b4aefa",
    "max_position_embeddings": 8192,
    "head_dim": 64,
    "dtype": "float16",
    "config_hash": "blake3:2b0aa2df414f30ac51640566f6f2911b0deea8027d59fda57611bb72598159be"
  },
  "integrity": {
    "payload_hash": "blake3:acca1229e537587e75108d1a25c3e28d7ce8036556137dc2973d9289187e58d4",
    "object_id_algorithm": "bifrost.object_id.v1",
    "descriptor_hash": "blake3:d97b3b11e17696f72fad3fc123e453051a2117c3a190469065cdb6d89a13ec2f",
    "chunk_size_bytes": 786432,
    "chunk_hashes": [
      "blake3:acca1229e537587e75108d1a25c3e28d7ce8036556137dc2973d9289187e58d4"
    ]
  },
  "engine_profile": {
    "kv_layout": "kv_token_head_dim",
    "kv_cache_format": "native_kv_pair_v1",
    "integration_version": "0.1.0-fixture",
    "integration_name": "bifrost-python-reference",
    "engine_version": "0.1.0-fixture",
    "engine_name": "bifrost-reference",
    "block_size_tokens": 256,
    "attention_impl": "flash_attention_2"
  },
  "created_by": "bifrost-phase1-fixture-generator",
  "created_at_unix_ms": 1779900000000
}
