{
  "created_at_unix_ms": 1779900000000,
  "created_by": "contextstorm",
  "engine_profile": {
    "attention_impl": "engine_owned",
    "block_size_tokens": 256,
    "engine_name": "lmcache",
    "engine_version": "0.1.0-fixture",
    "integration_name": "lmcache_bifrost_remote_storage",
    "integration_version": "0.1.0-fixture",
    "kv_cache_format": "opaque_lmcache_memory_obj",
    "kv_layout": "opaque"
  },
  "integrity": {
    "chunk_hashes": [
      "blake3:74cb441fd087764ca9c3694da742ebe30cbeb3060a17009ca81825c7a8d10343"
    ],
    "chunk_size_bytes": 1048576,
    "descriptor_hash": "blake3:72239f7ed94e2aa77c2f25f70b435216ee0b5ab0455802744c9d6b9159111d02",
    "object_id_algorithm": "bifrost.object_id.v1",
    "payload_hash": "blake3:74cb441fd087764ca9c3694da742ebe30cbeb3060a17009ca81825c7a8d10343"
  },
  "model_profile": {
    "config_hash": "blake3:2b0aa2df414f30ac51640566f6f2911b0deea8027d59fda57611bb72598159be",
    "dtype": "float16",
    "head_dim": 64,
    "max_position_embeddings": 8192,
    "model_hash": "blake3:b31dc7f5e94ff0290a04b7eaf3d1dda0c3036ac80682e5aecc658ccb46b4aefa",
    "model_id": "tiny-gpt",
    "model_revision": "local",
    "num_attention_heads": 12,
    "num_kv_heads": 12,
    "num_layers": 12,
    "quantization": "none",
    "rope_config_hash": "blake3:f27e0d4cd6df04c819b1541504d7886f5b1d320ee2efb3f5dc0f684d78353ebe",
    "tokenizer_hash": "blake3:7a96ceadf37d65c8bdc3bcd40f954bf7361e40828fe5d202769fda3746610750"
  },
  "native_tensor_profile": null,
  "object_id": "bifrost://object/blake3/b5aab7d85fc5f8d19ee7f2353ccfe06e649ed6ae85a9e3f8e8bb6c03997cda2e",
  "object_type": "opaque_engine_blob",
  "opaque_engine_profile": {
    "engine_key_hash": "blake3:3281132c3993dcf87fb69e7e034bb79166cf9d41d14022f8d33776b98a4140db",
    "engine_key_repr_version": "fixture-v1",
    "engine_payload_type": "lmcache_memory_obj"
  },
  "payload_profile": {
    "byte_length": 1048576,
    "compression": "none",
    "payload_encoding": "raw_bytes"
  },
  "prefix_profile": null,
  "provenance": {
    "notes": "Deterministic synthetic Phase 2 benchmark object.",
    "producer_commit": "0000000000000000000000000000000000000000",
    "producer_hostname": "localhost",
    "source": "contextstorm"
  },
  "schema_version": "bifrost.kv_object.v1alpha1"
}
