{
  "created_at_unix_ms": 1779900000000,
  "created_by": "bifrost-phase1-fixture-generator",
  "engine_profile": {
    "attention_impl": "flash_attention_2",
    "block_size_tokens": 256,
    "engine_name": "bifrost-reference",
    "engine_version": "0.1.0-fixture",
    "integration_name": "bifrost-python-reference",
    "integration_version": "0.1.0-fixture",
    "kv_cache_format": "native_kv_pair_v1",
    "kv_layout": "kv_token_head_dim"
  },
  "integrity": {
    "chunk_hashes": [
      "blake3:acca1229e537587e75108d1a25c3e28d7ce8036556137dc2973d9289187e58d4"
    ],
    "chunk_size_bytes": 786432,
    "descriptor_hash": "blake3:5ec52478a09dc55cea4b466b4fc07224e80357333dae433347e9d61fc7bdbf53",
    "object_id_algorithm": "bifrost.object_id.v1",
    "payload_hash": "blake3:acca1229e537587e75108d1a25c3e28d7ce8036556137dc2973d9289187e58d4"
  },
  "model_profile": {
    "config_hash": "blake3:2b0aa2df414f30ac51640566f6f2911b0deea8027d59fda57611bb72598159be",
    "dtype": "float16",
    "head_dim": 64,
    "max_position_embeddings": 8192,
    "model_hash": "blake3:b31dc7f5e94ff0290a04b7eaf3d1dda0c3036ac80682e5aecc658ccb46b4aefa",
    "model_id": "tiny-gpt",
    "model_revision": "local",
    "num_attention_heads": 12,
    "num_kv_heads": 12,
    "num_layers": 12,
    "quantization": "none",
    "rope_config_hash": "blake3:f27e0d4cd6df04c819b1541504d7886f5b1d320ee2efb3f5dc0f684d78353ebe",
    "tokenizer_hash": "blake3:7a96ceadf37d65c8bdc3bcd40f954bf7361e40828fe5d202769fda3746610750"
  },
  "native_tensor_profile": {
    "block_size_tokens": 256,
    "block_token_count": 256,
    "kv_block_id": 7,
    "layer_id": 3,
    "tensor_dtype": "float16",
    "tensor_layout": "kv_token_head_dim",
    "tensor_role": "kv_pair",
    "tensor_shape": [
      2,
      256,
      12,
      64
    ],
    "token_range": {
      "end": 2048,
      "start": 1792
    }
  },
  "object_id": "bifrost://object/blake3/bfd0b8e5cf9664b3756bba3343643a8925017f068b58dfb7ccc413d45674e742",
  "object_type": "native_kv_page",
  "opaque_engine_profile": null,
  "payload_profile": {
    "byte_length": 786432,
    "compression": "none",
    "payload_encoding": "raw_bytes"
  },
  "prefix_profile": {
    "absolute_position_range": {
      "end": 2048,
      "start": 1792
    },
    "mm_hashes": [],
    "prefix_hash": "blake3:2fb44b50964045c39d1ee2869bfb4b6962478de72b6325fd5ea5decf4e68c6a4",
    "rope_config_hash": "blake3:f27e0d4cd6df04c819b1541504d7886f5b1d320ee2efb3f5dc0f684d78353ebe",
    "token_count": 2048,
    "token_hash": "blake3:65bcf9510a74918b767acee13a31623594b55369bdf78ec0cb265cec948f0c8d",
    "token_range": {
      "end": 2048,
      "start": 1792
    },
    "tokenizer_hash": "blake3:7a96ceadf37d65c8bdc3bcd40f954bf7361e40828fe5d202769fda3746610750"
  },
  "provenance": {
    "notes": "Generated by tools/generate_phase1_fixtures.py.",
    "producer_commit": "0000000000000000000000000000000000000000",
    "producer_hostname": "localhost",
    "source": "native_valid_layer3_block7"
  },
  "schema_version": "bifrost.kv_object.v1alpha1"
}
